{
  "id": "b2c3d4e5-f6a7-8901-bcde-f12345678901",
  "project_id": "a1b2c3d4-e5f6-7890-abcd-ef1234567890",
  "title": "WebSocket Refactor",
  "status": "active",
  "content": "Refactor the CLI to use WebSocket communication.",
  "progress": "50% complete",
  "chat_history": [{"role": "user", "message": "Start the refactor"}],
  "session_id": "sess-001"
}
